Candidato,VideoID,Comentario,FechaHora												
"Verónika Mendoza,tm8zU8MfVU8,""Buena Fluidez de palabra, consecuente con lo que dice, Vero es la voz"",2016-02-01T04:06:03Z"												
"Verónika Mendoza,tm8zU8MfVU8,""Esta candidata no me convence. Además, representa una corriente de izquierda que no ha avanzado en el tiempo y hacen las cosas al revés. Dice lo que todos sabemos. No convence. Veamos su equipo. Peor, un personaje oscuro y negativo como el 'padre' Arana. Nada que ver con este grupo. Recordemos que los 'izquierdistas' son especialistas con las palabras y movimiento de masas y solo porque leyeron un poco más que Acuña pero son palabras sin peso específico."",2016-02-01T03:50:52Z"												
"Verónika Mendoza,tm8zU8MfVU8,""Desde el primer día Veronika estubo en el hablar de los comentaristas televisivos .. por que?... que era ella para que llame la atención .. o es que nos quieren imponer a un candidato de """"izquierdas""""?. Para mi ella es una moralista no izquierdista. Su verbo es leído, no construido."",2016-02-01T00:27:09Z"												
"Verónika Mendoza,tm8zU8MfVU8,""Hey jefecito tomate, Tienes que escuchar a los candidatos pe. Barnechea propone la revision de los acuerdos aereos con Lanperu y los acuerdos del gas de camisea. Cual chile compadre. Barnechea tiene casi la misma vision de Julio Guzman, pero Alfredo tiene mucha mas experiencia politica."",2016-02-01T00:04:44Z"												
"Verónika Mendoza,tm8zU8MfVU8,""otra chistosa que se ha memorizado su discurso, parece cuando exponen en la universidad."",2016-01-31T20:13:07Z"												
Verónika Mendoza,tm8zU8MfVU8,ASI SE HABLA CARAJO,2016-01-31T05:58:17Z												
Verónika Mendoza,tm8zU8MfVU8,VERONICA MENDOZA INSULTA A KEIKO SOLO PARA PROBAR SU EXISTENCIA,2016-01-30T22:30:42Z												
Verónika Mendoza,tm8zU8MfVU8,SOLO LOS ANTIMINEROS VOTARAN POR ELLA,2016-01-30T22:29:59Z												
"Verónika Mendoza,tm8zU8MfVU8,""que mal inicio por parte de esa mujer deberia dejar de lanzar indirectas, GRACIAS A DIOS TIENE 2%"",2016-01-30T22:29:39Z"												
"Verónika Mendoza,tm8zU8MfVU8,""MANITA LOS MILLONES NO VAS A PODER RECUPERAR, PERO SI PUEDES EVITAR QUE LOS CORRUPTOS SIGAN ROBANDO"",2016-01-30T22:11:21Z"												
"Verónika Mendoza,tm8zU8MfVU8,""Más de lo mismo, lo que se puede reconocer es que pone más énfasis al decir y acusar, más de lo que el peruano desea escuchar, más de ello no está preparada, no tiene experiencia, se la van a comer una vez ya en palacio, son ideas generales, bonitas pero nada más, candidata decente pero hay alguien mejor."",2016-01-30T19:01:08Z"												
"Verónika Mendoza,tm8zU8MfVU8,""La mejor candidata , honesta y valiente, ..bien Vero... muerte civil a los corruptos...Tienes mi voto y de toda mi comunidad..Vero Presidente!!"",2016-01-30T10:10:55Z"												
"Verónika Mendoza,tm8zU8MfVU8,""julio guzmán propuso sus ideas sin leer,eso lo dice todo,es un capo,mi voto es por julio guzmán"",2016-01-29T21:58:22Z"												
Verónika Mendoza,tm8zU8MfVU8,toma keiko...!!! toma alan...!!!! toma acuña...!!!,2016-01-29T17:37:35Z												
Verónika Mendoza,tm8zU8MfVU8,no esta preparada. yo voto por julio guzman,2016-01-29T16:09:38Z												
Verónika Mendoza,tm8zU8MfVU8,veronica es una persona intachable justo lo que el peru necesita,2016-01-29T15:59:08Z												
Verónika Mendoza,tm8zU8MfVU8,Dejemos de lado las encuestas y votemos por nuestro candidato,2016-01-29T15:10:00Z												
"Verónika Mendoza,tm8zU8MfVU8,""Bla, bla, bla, lo mismo de siempre no me convence, haber que dicen los otros candidatos."",2016-01-29T12:38:56Z"												
"Verónika Mendoza,tm8zU8MfVU8,""Y DE SU COMADRITA NADINE NO DICE NADA"												
ELLA FUE SU SECRETARIA 												
"Q NO JODA"",2016-01-29T08:08:12Z"												
Verónika Mendoza,tm8zU8MfVU8,POPULISTA SIN EXPERIENCIA AMIGUITA DE NADINE,2016-01-29T08:06:40Z												
"Verónika Mendoza,tm8zU8MfVU8,""Veronica como congresista, no aportaste beneficios tangibles al Perú, iniciaste con humala y terminaste como oposición, que puedes saber de decisión, lealtad y liderazgo. NO COMPARTO NI DEFIENDO EL MEDIOCRE GOBIERNO DE HUMALA , pero es sólo mi pensar, antes de tomar una decisión de elegir ser militante de un partido, sabiendo de donde era financiado no dijiste nada, pero por una mala investigación en Cusco, la cual tu presidías que paso??? Y cuándo te diste cuenta que saldría a la luz la corrupción de HUMALA que paso??? ."												
												
"Por favor no le mientas al país."",2016-01-29T06:42:29Z"												
Verónika Mendoza,tm8zU8MfVU8,otra burra de mierda,2016-01-28T22:15:58Z												
Verónika Mendoza,tm8zU8MfVU8,UNA BUENA OPCION.......  VAMOS VERONIKA   ...!!!!,2016-01-28T17:52:50Z												
"Verónika Mendoza,tm8zU8MfVU8,""Grande Vero...siempre adelante señora presidenta, hasta la victoria final!!!!"",2016-01-28T02:14:59Z"												
Verónika Mendoza,tm8zU8MfVU8,AUN TE FALTA VERO...PERO ESTA VEZ VOTARE POR BARNECHEA..... AUNQUE LOS DOS MEJOR OPCION QUE EL CARETA DE GUZMAN,2016-01-28T01:19:16Z												
"Verónika Mendoza,tm8zU8MfVU8,""Que leas me dice, que tu no dices lo que lees, esta redactado con el fin de salir bien... Pero te falta convicción!  si la tuvieras todo lo tendrías memorizado porque es algo que te obsesiona y ser te graba... "												
												
"Ella piensa que está exponiendo un tema como en el universidad... (Ser presidente no es una tesis) LO SIENTO PERO TE FALTA!"",2016-01-27T18:55:56Z"												
"Verónika Mendoza,tm8zU8MfVU8,""Por el momento a 15 CORRUPTOS no le gusta este video :V"												
"ptt. Yo también pensé que mis audífonos estaban mal."",2016-01-27T18:53:17Z"												
"Verónika Mendoza,tm8zU8MfVU8,""no leas PE, sé como Barnechea o Guzmán, di lo que sabes sin papelito...sólo guiate de él."",2016-01-27T17:45:28Z"												
Verónika Mendoza,tm8zU8MfVU8,Otra vez... lo de regular los medios???? Como siempre los izquierdistas disparandose a los pies!! jajajaj Ayayay,2016-01-27T14:15:09Z												
"Verónika Mendoza,tm8zU8MfVU8,""Así se habla Verónica Mendoza, todos estos corruptos deben salir y de esta manera el estado sea libre y desarrolle para beneficio del pueblo."",2016-01-27T13:26:57Z"												
Verónika Mendoza,tm8zU8MfVU8,lo que le falta en la propuesta de veronica es estudiar el modelo de abitrariedad y fasilidaddes tecnicas fisicas que tiene un congresista corrupto para que fisicamente por procedimiento de validacion las capacidades de que el congresista pueda hacer por corrupcion sean blokeadas y las buenas no blokeadas. hablamos de procedimientos tecnicos fisicos. ejm las leyes y las propuestas de congreso que no son escrita en la pag web donde todo informacion debe de estar hay esa ley no aplica no vale no exite si existe es una imprudencia contra el sistema. y para que la gente lea eso debe ser de ley que en todas las univercidades que se estudien derecho vean eso de periodico y que todo los programas de televicion deban de hacer un comercial algo al respecto o letras abajo de amor amor sobre noticias de eso al respecto. tiene que tener ese espiritu trabajador de leguia sabes que? comete tu verdura si o si te alimenta tu mente..!!  en los periódicos de la univercidad..!! en todos los periódicos de ley una rallita en el margen del periódico no importa..!! donde siempre ponen pagina web ha entrar..!! exigir a los profesores de la historia del peru llamar las cosas por su nombre al corrupto corrupto...!! un solo chat conectado al face book al tewiter hay muchas pg web que usas face book para opinar y aparecen también en la pag web ..!!,2016-01-27T08:57:33Z												
Verónika Mendoza,tm8zU8MfVU8,Vamos Vero!!! Contra viento y marea.,2016-01-27T04:30:50Z												
Verónika Mendoza,tm8zU8MfVU8,la señora que voto para que mas soldados de los eeuu entren al pais Verónika Mendoza en Foro PROÉTICA,2016-01-27T03:14:11Z												
Verónika Mendoza,tm8zU8MfVU8,vamos voten por su 1% echen sus votos al tacho  soy realista  su 1% se ira al tacho = k sus seguidores tenesmos k elegir la mejor opcion entre los 4 mejores en el rank  conste no digo ks ea una mala opcion es una buenisima opcion pero le veo voto ala basura solo ayudaran a las ratas acuñistas al dividir los votos porlos k queremos un peru mejor,2016-01-27T01:23:01Z												
Verónika Mendoza,tm8zU8MfVU8,Doyle,2016-01-26T23:04:04Z												
Verónika Mendoza,tm8zU8MfVU8,Interesante propuesta,2016-01-26T22:57:31Z												
"Verónika Mendoza,tm8zU8MfVU8,""las cosas claras, y eso atrae a saber mas de ti, buena competencia para julio guzman"",2016-01-26T19:19:57Z"												
Verónika Mendoza,tm8zU8MfVU8,veronika mendoza  1000000000000 veces mejor  k  todos  los demas candidatos,2016-01-26T18:58:02Z												
"Verónika Mendoza,tm8zU8MfVU8,""VERONIKA MENDOZA ES LA MEJOR OPCION , LOS DEMAS YA GOBERNARON Y QUIEREN SEGUIR GOBERNANDO , SIN NINGUNA DUDA MI VOTO ES PARA VERONIKA MENDOZA PRESIDENTA 2016"",2016-01-26T18:29:18Z"												
Verónika Mendoza,tm8zU8MfVU8,Si condenas a la dictadura corrupta de chavismo de Maduro  en Venezuela te creo si no es lo mismo de siempre.,2016-01-26T17:01:47Z												
Verónika Mendoza,tm8zU8MfVU8,No es RPP es RPCH.,2016-01-26T17:00:46Z												
Verónika Mendoza,tm8zU8MfVU8,Creo que votare por ella.,2016-01-26T16:12:09Z												
"Verónika Mendoza,tm8zU8MfVU8,""Vero, eres lo maximo,  vien dicho a todos los corruptos."",2016-01-26T16:09:52Z"												
Verónika Mendoza,tm8zU8MfVU8,Debe haber mano  firme  contra el  corrupto  pero también contra el corruptor!  interesante presentación Verónika Mendoza,2016-01-26T15:48:32Z												
"Verónika Mendoza,tm8zU8MfVU8,""Verito que grande eres, tu tienes mi voto desde tus inicios a la candidatura, formidable tu exposicion, ojala lo difundan este video en los canales de television , cosa dificil porque los medios de comunicacion lamentablemente estan manipulados por la corrupcion e intereses oscuros"",2016-01-26T12:38:53Z"												
"Verónika Mendoza,tm8zU8MfVU8,""QUIENES.SON LOS 10 QUE PONEN (NO ME GUSTA).SI LA.MUJER HABLO LA.VERDAD Y SUS PROPUESTAS SON CLAVE PARA LA JUSTICIA DE ESTE PAIS, SEGURO.ESOS MIERDAS.SE.CONFORMAN CON LO QUE AHORA.ES.O SON SICARIOS.Y GENTE.DE.MAL.VIVIR.QUE SE.VENDE POR UN CALZON....!!!!"",2016-01-26T08:06:10Z"												
Verónika Mendoza,tm8zU8MfVU8,Verónica  eres la única mujer en estas elecciones correcta y que  quiere trabajar por la patria .,2016-01-26T07:32:23Z												
Verónika Mendoza,tm8zU8MfVU8,El Perú quiere y necesita un nuevo Perú.,2016-01-26T05:32:22Z												
"Verónika Mendoza,jXE38lMYAcI,""Verónica porque no hablas de bolivia y su crisis económica... Estás muy callada, tu no eres asi ??"",2023-04-06T05:15:18Z"												
Verónika Mendoza,jXE38lMYAcI,Considero que la consulta previa NO es efectivo por dos cosas: 1ro. que el gobierno no informo detalladamente sobre el tema y 2do. por que se involucro una sensación ideologica en esta interesante herramienta de participación.,2015-01-21T17:26:31Z												
"Verónika Mendoza,jXE38lMYAcI,""Considero que la consulta previa, permite aperturar un proceso de dialogo en el que tiene que definir los beneficios económicos, ambientales y sociales hacia las comunidades, que no pongan en riesgo la superveniencia de los pueblos indígenas, frente a las actividades extractivas.   asimismo una debida compensación e indemnización ante daños que pudiera ocasionar."",2014-04-15T06:02:14Z"												
Verónika Mendoza,jXE38lMYAcI,Todo mi respeto Verónica Mendoza! ,2014-04-15T04:17:45Z												
"Verónika Mendoza,-YK_34iaWfE,""LOS PERSONEROS LEGALES  DE RAFAEL LÓPEZ ALIAGA , DEBEN TENER MUCHA HABILIDAD MENTAL PARA CONTRASTAR LAS ACTAS EN CADA REGIÓN DE LA ONPE , CON LAS ACTAS QUE LA MESA DE SUFRAGIO ENTREGA , DESPUÉS DEL CONTEO  , ENTREGA A CADA PARTIDO POLITICO A TRAVÉS DE SUS PERSONEROS DE MESA , ESAS ACTAS QUE LLEVA LA ONPE DE CADA MESA , TIENEN QUE SER FIRMADAS POR LOS PERSONEROS DE MESA E AHÍ EL PERSONERO  LEGAL TIENE QUE VERIFICAR QUE LAS FIRMAS DE LAS ACTAS QUE VAN A SER CONTADAS , SEAN LAS QUE LLEVAN LA FIRMA DEL PERSONERO DE MESA , YA QUE EL CONTEO ES REGIONAL , LOS CUÁLES SON SUMADOS EN ONPE LIMA , CON UNA RAPIDEZ DE LA LUZ .SI ESO OCURRE QUE EL CONTEO SEA VOTO A VOTO  . PERSONEROS LEGALES CON MUCHA HABILIDAD MENTAL Y LOS PERSONEROS DE MESA FIRMEN TODAS LAS ACTAS       ( 06 ) QUE LLEVA LA ONPE , POR QUE SE DAN CASOS QUE EL PRESENTE DE MESA PREGUNTA QUIEREN FIRMAR TOADAS LAS ACTAS ?  Y ALGUNOS PERSONEROS DUCEN , NO SOLAMENTE LA MÍA , ÉNFASIS EN ESO CAPACITADORES DE MIEMBROS DE MESA ..."",2021-04-11T20:41:12Z"												
"Verónika Mendoza,-YK_34iaWfE,""Ojalá gane Verónika Mendoza. Mujer  inteligente, equilibrada y se expresa muy bien."",2021-04-10T20:05:22Z"												
"Verónika Mendoza,-YK_34iaWfE,""Se nota el sarcasmo burlesco de estos seudoperiodistas, puta que aburrido... Lo bueno es que pronto serán viejos. Y espero que en un futuro no muy lejano podamos ser diferentes a este tipo de personas."",2021-04-10T04:38:41Z"												
Verónika Mendoza,-YK_34iaWfE,Efectivamente es hora de dar oportunidad a una persona que tiene las ideas claras para el cambio ya que la derecha a demostrado un fracaso rotundo para el desallo de los más pobres,2021-04-09T19:51:23Z												
Verónika Mendoza,-YK_34iaWfE,LOS TRES CHIFLADOS!!!,2021-04-09T18:58:50Z												
"Verónika Mendoza,-YK_34iaWfE,""No salen del  “papá estado proveerá”"												
El modelo socialista matará al emprendedor	" prefiere un estado pesado y por supuesto lerdo, para robar y beneficiar al grupo gobernante, gastará para difundir su mensaje de terror y hacer dependiente a la población de las dádivas del estado. Yo no quiero eso para mis hijos."",2021-04-09T18:05:05Z"											
"Verónika Mendoza,-YK_34iaWfE,""Esta mujer apoya la politica de Evo Morales un narco presidente como amigo del presidente de Venezuela Nicolas Maduro,como podemos apoyar al  veronika mendoza si nos llevara a un Venezuela al Peru."",2021-04-09T15:52:03Z"												
Verónika Mendoza,-YK_34iaWfE,Es cierto que Verónika dice que es suficiente con comer una vez al día? No jodas ps,2021-04-09T15:03:09Z												
Verónika Mendoza,-YK_34iaWfE,Así hablaba Chávez....,2021-04-09T01:34:42Z												
"Verónika Mendoza,-YK_34iaWfE,""Si to fuera peruana, yo votaria en esa senora. Se nota su preparo. Su conocimiento de la politica y mas q todo su plan de gobierno. Es clara e inteligente. Me gustas sus argumentos."",2021-04-08T22:19:06Z"												
"Verónika Mendoza,-YK_34iaWfE,""Siempre he dicho quieren ZATANIZAR a la IZQUIERDA a pesar de que nunca han sido GOBIERNO como siempre los ULTRADERECHA Y LA DERECHA en si misma como siempre se distinguido como unos MALVADOS diciendo su MENTIRA como si fuera un DISCO RAYADO que no tienen argumento para DESTAPAR la CORRUPCION porque diempre se han COLUDIDO con la COIMA, como el robo sistematico, como haciendo obras inconclusas sin mediar el contro para no irse a la CARCEL donde deben estar robando al ESTADO trabando el progreso del PERU."												
NO soy Izquierdista pero la sora VERONICA MENDOZA me llena los ojos viendola porque es una BELLEZA DE MUJER PERUANA es provinciana, es una mujer NOBLE con ella se llenaria de halagos los demas paises seria una mujer INTERESANTE.												
La señora Veronica Mendoza es una mujer inteligente con mucha habilidad, lo que no pudo la derecha fue de avanzar dino nod trajo un atrazo enorme al PERU porque mas se dedicaron a saquear al Erario Nacional por el apetito del DINERO mal habido, dejando de pagar sus IMPUESTOS, este dinero esta deuda seria para la gente VUNERABLES dejando sin comida a niños, niñas, ancianos, ancianas, madres solteras es decir dejando en ABANDONO a su suerte es tiempo que la ULTRADERECHA cambie porque estamos en el siglo XXI.												
Por eso digo la señora VERONICA MENDOZA es de una BELLEZA desbordante, es SIMPATICA dejando una estela de simpatia por eso lo aclama la gente provinciana porque es su paisana por derecho propio debe ganar para ser GOBIERNO.												
"Señor LIMEÑO tu que eres INDECISO  VOTA por VERONICA MENDOZA en cuanto a los HOMBRES limeños tu me dijeron que es una mujer ENCANTADORA porque tiene una BELLEZA descomulgal, me dicen mi voto es para la simpatica de VERONICA......EUREKA.......tu me conoces .......chauuuuuuuu"",2021-04-08T20:23:20Z"												
Verónika Mendoza,-YK_34iaWfE,https://youtu.be/0l1g0kwOAh0,2021-04-08T02:59:36Z												
Verónika Mendoza,-YK_34iaWfE,Veronika Mendoza ???,2021-04-07T23:57:55Z												
"Verónika Mendoza,-YK_34iaWfE,""Veronica Mendoza no solo sera nuestra Presidenta si no tambien nuestra reyna  Mavila deja que veronica Mendoza termine de hablar no interrumpas,porque el Peru no puede escuchar dos voces a ala vez,Mavila se mas educada,respetuosa porque en realidad  te comportas como una VERDULERA, tu no eres la entrevistada,tu solo pregunta y no emitas ningun comentario deja que el entrevistado responda tu pregunta eso es lo que Peru quiere. https://youtu.be/sS2jaby2FJk"												
https://youtu.be/RV0mC9xdj-U  VERONIKA TENDRA QUE GANAR LAS PERUANAS TENDRAN QUE APOYARLA												
"https://youtu.be/-YK_34iaWfE En esta entrevista Jaime Chincha mas o menos se comporto bien,la mujer un poco mas impetuosa e irrespetuosa,Las entrevistas son bien sencillas el entrevistador y el o la entrevistada,pregunta y respuesta,sin interferencias,el pueblo escuchara muy bien."",2021-04-07T22:14:19Z"												
"Verónika Mendoza,-YK_34iaWfE,""Mavila deja que veronica Mendoza termine de hablar no interrumpas,porque el Peru no puede escuchar dos voces a ala vez,Mavila se mas educada,respetuosa porque en realidad  te comportas como una VERDULERA, tu no eres la entrevistada,tu solo pregunta y no emitas ningun comentario deja que el entrevistado responda tu pregunta eso es lo que Peru quiere. https://youtu.be/sS2jaby2FJk"												
"https://youtu.be/RV0mC9xdj-U  VERONIKA TENDRA QUE GANAR LAS PERUANAS TENDRAN QUE APOYARLA"",2021-04-07T22:11:28Z"												
"Verónika Mendoza,-YK_34iaWfE,""Clara e inteligente, mi voto este 11 de abril es para Verónica."",2021-04-07T21:21:27Z"												
Verónika Mendoza,-YK_34iaWfE,Bienvenida la inversión privada responsable y las puertas del Estado estarán abiertas... Vamos Vero y JP ??????????????,2021-04-07T21:04:12Z												
"Verónika Mendoza,-YK_34iaWfE,""Verónica será la Próxima PRESIDENTE del Perú. Ya estamos cansados que nos Gobierne la DBA"												
"que ha ampliado la brecha entre ricos y pobres."",2021-04-07T20:40:56Z"												
"Verónika Mendoza,-YK_34iaWfE,""La DBA está asustada que le quiten su Status Quo, VERÓNICA PRESIDENTE JP ????????, está creciendo en las encuestas para acabar con tantos Corruptos que viven del Estado."",2021-04-07T20:39:12Z"												
"Verónika Mendoza,-YK_34iaWfE,""Patricia del Rio, gestora de desinformación, si Biden de USA lo esta haciendo para recaudar impuestos a traves de las grandes empresas en EEUU. bueno es notorio que esta parcializada la conductora."",2021-04-07T19:33:24Z"												
Verónika Mendoza,-YK_34iaWfE,Chávez dijo lo mismo,2021-04-07T17:17:04Z												
"Verónika Mendoza,-YK_34iaWfE,""Adios corruptos, eso les pasa por arrinconar a los Morados, ahora Veronica los va a limpiar de una vez por todas."",2021-04-07T17:09:10Z"												
"Verónika Mendoza,-YK_34iaWfE,""Todo partido comunista o socialista destruyen a los países los dejan en miseria , jamás votaré por esta mujer Terruca ."",2021-04-07T13:45:57Z"												
"Verónika Mendoza,-YK_34iaWfE,""No interrumpan, dejen que la candidata explique. Con la interrupción las propuestas e ideas se quedan incompletas. Hagan más fácil a los votantes. No se aloquen!!!!"",2021-04-07T12:37:12Z"												
"Verónika Mendoza,-YK_34iaWfE,""Cual es más importante, el tiempo o que la candidata explique?????"",2021-04-07T12:34:37Z"												
Verónika Mendoza,-YK_34iaWfE,con verónica lograremos el cambio en el Perú,2021-04-07T08:43:49Z												
Verónika Mendoza,-YK_34iaWfE,Mas estado=más rovos,2021-04-07T07:07:38Z												
"Verónika Mendoza,-YK_34iaWfE,""LA HIPOCRECIA DE NUESTRA SOCIEDAD!!!!......QUE Y CUAL DEMOCRACIA???... LA DE LOS RICOS... LA DE LOS ARRIBISTAS, OPORTUNISTAS, DEMAGOGOS, PERIODISTAS O COMENTARISTAS MERMELEROS, LA DE LOS POLITICOS DE DERECHA NEOLIBERAL QUE UTILIZAN A SUS LAGARTOS, LA DE LA IZQUIERDA """"CAVIAR"""" CORRUPTA Y TRAIDORA DEL PUEBLO....O LA VERDADERA LA DE LOS POBRES DEL PERU QUE ESTAN ESPERANDO DESDE HACE SIGLOS... ES DECIR DE UNA VERDADERA DEMOCRACIA POPULAR Y CON JUSTICIA SOCIAL"",2021-04-07T02:09:58Z"												
Verónika Mendoza,-YK_34iaWfE,Mi candidata!!,2021-04-06T21:45:00Z												
Verónika Mendoza,-YK_34iaWfE,Los creditos baratos que dice no estan para los q pertenecen al regimen Rus... nosotros somos emprendedores q tambien tenemos deudas y estamos propensos a caer .... sigue con la misma rutina de los gobiernos anteriores ????,2021-04-06T21:42:00Z												
Verónika Mendoza,-YK_34iaWfE,???????? no pasa nada... es muy idealista para crear riqueza... como va aumentar los impuestos a las grandes empresas si las empresas de rafael lopez aliaga ni paga .. los congresistas no lo van a permitir.... ellos..  sus familias.. sus amigos tienen grandes empresas y ellos se benefician d ello.. ejm a CATERIANO lo vacaron xq no sedio ante la SUNEDU pepe luna.. acuña etc tienen sus negocios q es la educacion.. veronica lo q hace es hablar bonito y no dice como lo va hacer.. populismo,2021-04-06T21:32:20Z												
"Verónika Mendoza,-YK_34iaWfE,""Por el bien del país, Verónika nunca"",2021-04-06T21:18:33Z"												
"Verónika Mendoza,-YK_34iaWfE,""Una lástima los conductores, .... sus intereses económicos pesan más..."",2021-04-06T18:15:09Z"												
Verónika Mendoza,-YK_34iaWfE,Jaime la mala leche  de. Periodismo.    No pasa nada  ...,2021-04-06T17:07:17Z												
"Verónika Mendoza,-YK_34iaWfE,""Como no va a pasar la valla no va a tener que dialogar con nadie, y cuando no el mermelero echandole un salvavidas a la Vero."",2021-04-06T16:27:22Z"												
"Verónika Mendoza,-YK_34iaWfE,""ESTA  SENORA ES UNA GRAN MENTIROSA AL IGUAL QUE LESCANO!!!!!!!!!"												
"LOS PERUANSOS NO SOMOS TONTOS!!!!!!!"",2021-04-06T14:51:48Z"												
"Verónika Mendoza,-YK_34iaWfE,""Porque no le preguntan a la Veronica M. sobre las agendas de NADINE, la Sra era asistente de Nadine donde habia (lavado de activos y compras millonarias con la plata de la gente pobre que honestamente pagan sus impuestos) y en muchas de las agendas ella(Nadine y Mendoza) tenian contacto con el Chavismo y las cosas que planeaban hacer en el Peru.....Sino me creen miren este video e informense no podemos seguir cometiendo el mismo error......""""?@"""""",2021-04-06T02:00:18Z"												
Verónika Mendoza,-YK_34iaWfE,VERONIKA MENDOZA PRESIDENTA,2021-04-05T23:51:46Z												
"Verónika Mendoza,-YK_34iaWfE,""Buena Patricia: """"Movidas en las encuestas"""", te faltó agregar manejados por los grupos de poder. Peruano dile no al miedo, no a la corrupción."												
"https://www.facebook.com/watch/?v=158414146068201"",2021-04-05T20:05:32Z"												
Verónika Mendoza,-YK_34iaWfE,PLAN CHAMBA IGUAL QUE EL DE VENEZUELA https://www.youtube.com/watch?v=43dLTQphhbU,2021-04-05T18:32:15Z												
"Verónika Mendoza,-YK_34iaWfE,""Esta terruca hace lo mismo que chavez cuando empeso. Uds comparen a Humala y los comienzos d3 Chavez y ahora Veronica. Acaso no saben que ella registro su asistencia al Foro de Sao Pablo."												
NO VOTEN POE ESTA MUJER.												
"VENDRAN 100 AÑOS DE ATRASO AL PERÚ."",2021-04-05T16:04:44Z"												
Verónika Mendoza,-YK_34iaWfE,No quieren bloquear a la empresa privada sino destrosarla.,2021-04-05T16:01:56Z												
Verónika Mendoza,-YK_34iaWfE,Más impuestos para los peruanos que pena la gente que quiere eso para su país,2021-04-05T14:57:30Z												
"Verónika Mendoza,-YK_34iaWfE,""Vamos Vero, necesitamos una presidenta ejemplar para el BICENTENARIO!"",2021-04-05T14:13:28Z"												
"Verónika Mendoza,-YK_34iaWfE,""Si ven los discursos de Chávez en esos tiempos que Venezuela dominaba y su retórica era la misma masificación y más más, y Verónica solo quiere hacernos creer que instituciones estatales manejan mejor jajaja"",2021-04-05T12:44:55Z"												
"Verónika Mendoza,-YK_34iaWfE,""Dos impresentables mermeleros : Del Río que QUIZAS lo es forzadamente, pero el otro lo es con agrado porque no tiene ni una pizca de dignidad. Chincha hace rato que se arrodilló no necesariamente para rezar sinó para recibir ordenes de sus amos."",2021-04-05T00:57:49Z"												
Verónika Mendoza,-YK_34iaWfE,Veronica  está contra las leyes de Dios   no pasa nada  ni voto  no,2021-04-05T00:56:19Z												
"Verónika Mendoza,-YK_34iaWfE,""Buena entrevista. Buenos puntos tratados, buena respuesta de Verónica."",2021-04-04T23:33:12Z"												
"Verónika Mendoza,-YK_34iaWfE,""Yo le digo, NO, a la extrema derecha y extrema izquierda!!!   Sólo generarán conflictos.Apostemos por el centro, apostemos por la estabilidad del país!!!"",2021-04-04T23:12:16Z"												
"Verónika Mendoza,-YK_34iaWfE,""No VERONICA....muy equivocada estas ....la gente quiere mas tapers..... por eso  ....todos a votar por la hija del creador de las afp..... la sra k, Ella salvara a los peruanos de la aplicacion salvaje de teorias macroeconomia neoliberal (implementada por su papi) que jncremento exponencialmente nuestra endemica Corrupcion causante y causante del completo  abandono del estado puesto a la luz por esta pandemia y la crisis sanitaria.... no a VERONICA"												
												
