Candidato,VideoID,Comentario,FechaHora												
"César Acuña,HnruyOJfb80,""Porqué nadie habla que fue denunciado con pruebas fehacientes de v1ol4cion a una men,or de su academia... ese tipo es de lo peor,... sin mencionar que se lucra de los pobres por un kilo de arroz y luego les roba a manos llenas en el poder y ayuda a los cr1minales y n4r,cos quienes son sus aliados..."",2025-01-25T05:08:43Z"												
César Acuña,HnruyOJfb80,Acuña es  millonario  por  la estupidez  de  los  padres en ponerlos    en  la universidad chancho ucv.,2025-01-22T18:11:49Z												
"César Acuña,HnruyOJfb80,""Bueno existía una foto del padre de los Acuña en carcel por tráfico con los Sánchez Paredes,habia otra foto en el Duomo de Milán frente a la galeria Vittorio Emmanuelle a César Acuña con motivo de un matrimonio de uno de los Paredes, lógicamente las sacaron"",2025-01-19T13:15:40Z"												
César Acuña,HnruyOJfb80,Todos saben que ese tipo es un delincuente y está metido en el narcotráfico con los Sánchez paredes acá en Trujillo tiene a toda la policía y la libertad comprada,2025-01-19T00:16:02Z												
César Acuña,HnruyOJfb80,El próximo presidente del Perú!,2025-01-18T22:38:18Z												
"César Acuña,HnruyOJfb80,""ACUÑATE, TODO EL DINERO HSBIDO Y POR HSBER  ESPERO SEAS PARTE INTEGRANTE DE LAS MSLDITAS ELITES, SUPERHAMBICIOSAS, INSACIABLES , ULTRSNEOLIBERTINOS,  RACISTAS."",2025-01-15T21:24:10Z"												
César Acuña,HnruyOJfb80,Que Tibio reportaje !!!!!!.. . . Todo esto ha dejado el FUJIMIERDISMO,2025-01-10T11:56:44Z												
César Acuña,HnruyOJfb80,La típica del imbécil que supone que nadie se da cuenta de su miseria mental y moral.....raza distinta? Jajaj,2025-01-01T21:34:58Z												
César Acuña,HnruyOJfb80,Se volvió millonario producto de la minería ilegal y el cultivo de hojas de coca para el narcotráfico...mucha gente en Huánuco ha hecho de pequeños encargos...y en la serranía de la libertad ...la mineria ilegal es frecuente...,2024-12-30T14:09:08Z												
César Acuña,HnruyOJfb80,Arreglos bajo la mesa …,2024-12-16T05:57:25Z												
"César Acuña,HnruyOJfb80,""CUALQUIERA PODRÍA, CON EL DELITO DE NARCOEDUCACION LOS LOPEZ PAREDES SON LOS PADRINOS."",2024-12-14T23:33:56Z"												
"César Acuña,HnruyOJfb80,""La verdad no es un plagio es una copia,  mejor dicho una fotocopia..."",2024-11-08T16:56:21Z"												
César Acuña,HnruyOJfb80,Su papa era narco,2024-10-20T12:32:30Z												
"César Acuña,HnruyOJfb80,""Con ek negocio de las univeridades"												
"ES HORA QUE PAGUE IMPUESTOS"",2024-10-20T12:32:05Z"												
César Acuña,HnruyOJfb80,Ps la respuesta corta es robo y corrupción. V:,2024-09-07T23:05:41Z												
César Acuña,HnruyOJfb80,Se hizo millonario lavando queso,2024-09-06T23:47:30Z												
César Acuña,HnruyOJfb80,Nuestro Pablo Escobar,2024-09-05T04:54:06Z												
César Acuña,HnruyOJfb80,Todo lo q se puede a ser con el Lavado d Activos,2024-08-28T01:53:23Z												
César Acuña,HnruyOJfb80,La actitud de César Acuña demuestra lo que es ha hecho trato con los mineros informarles los cuáles atacan a las mineras formales  y le dan dinero a César Acuña  como es izquierdistas le apoyan los izquierdistas que están en el congreso y en el poder judicial,2024-08-16T19:35:45Z												
César Acuña,HnruyOJfb80,Lavando dinero del narcotrafico,2024-08-15T06:01:06Z												
César Acuña,HnruyOJfb80,Lavando dinero del narcotrafico,2024-08-15T06:01:04Z												
César Acuña,HnruyOJfb80,Todavía tiene piernas???,2024-08-12T02:17:48Z												
"César Acuña,HnruyOJfb80,""Pues obviamente, haciendo lobby en contra del derecho a la educación estatal, (leyes que impidan que el estado haga muchas universidades estatales y con acceso gratuito, educación para todos y no solo para los cerebritos, hay gente con autismo, tdha, que también tiene derecho a estudiar) Pero si el estado hace eso, las universidades privadas dicen que es competencia desleal????, ¿Quien estudiaría en una universidad privada habiendo universidad estatales gratuita y con acceso para todos? Obviamente no sería millonario ese corrupto"",2024-07-25T16:54:10Z"												
"César Acuña,HnruyOJfb80,""Debes investigar bien un semianalfabeto que compró su título e invirtió en universidad bamba se volvió rico oh!! Que maravilla de hombre, cual es el origen de sus comienzos INVESTIGA MEJOR esa rata le hace daño al país ese miserable pudrió La Libertad - Trujillo."",2024-07-11T11:46:18Z"												
"César Acuña,HnruyOJfb80,""Se paso, de 20K a 9M en el 2012 a 145M el sgte año?? Jaja que burla, y que, nadie lo noto? Ninguna Universidad en el mundo es así de exitosa"",2024-07-10T20:44:32Z"												
César Acuña,HnruyOJfb80,La impunidad sigue en el país ??,2024-07-09T06:05:39Z												
"César Acuña,HnruyOJfb80,""...y Yo, pensé que era millonario, por cobrar regalias, de tantos memes que le sacaron...????????"",2024-07-08T04:20:00Z"												
César Acuña,HnruyOJfb80,Yo lustraba zapatos. Y vendia chupetes. Ahora tengo una cadena de zapateria.  Y heladería..... anda puee...,2024-06-27T13:35:19Z												
"César Acuña,HnruyOJfb80,""Yo tengo 2 amigos de taxistas  se volvieron.  Ricos ahora tienen  5 volquetes, 3 trailer.  Camionetas autos motos "												
"..?? yy como tan parecido."",2024-06-27T13:32:28Z"												
"César Acuña,HnruyOJfb80,""Lavando DINERO de la TALCO-ÍNA pues, ese bruto asno no sabe hacer nada, todo es talco nomás."",2024-06-05T07:08:53Z"												
César Acuña,HnruyOJfb80,ESTE SUJETO HIZO PLATA EN EL MUNICIPIO DE TRUJILLO!! ANTES QUE HACIA??????????,2024-05-24T15:38:40Z												
César Acuña,HnruyOJfb80,Acuña estudió Ing Química en la UNT. Yo soy Químico y mis profesores que me enseñaron la carrera son Ingenieros Químicos ex compañeros de Acuña.,2024-05-22T02:50:33Z												
"César Acuña,HnruyOJfb80,""Por sus conocimientos y su poder de convencimiento…imposible !  La especialidad romper la mano y meterse  a la política para beneficiarse….,,"",2024-05-17T16:13:46Z"												
César Acuña,HnruyOJfb80,Muy simple como hizo dinero. Siendo parte del gobierno como alcalde. Gobernador lo más seguro es que hubo mucha corrupcion dinero desviado compras indebidas  compras fantasmas. Compra de controladores. X eso todos quieren ser políticos ahí está el dinero,2024-05-15T14:27:58Z												
César Acuña,HnruyOJfb80,El sátrapa no paga impuestos en detrimento de las escuelas públicas.,2024-05-09T06:24:15Z												
César Acuña,HnruyOJfb80,KORRUPCION,2024-05-08T14:56:02Z												
César Acuña,HnruyOJfb80,La verdad yo no le creo acuña ni lo que come ..a mi me es muy raro todo ese imperio que tiene,2024-05-03T21:34:13Z												
César Acuña,HnruyOJfb80,La rat4 de Acuña,2024-04-26T04:08:16Z												
"César Acuña,HnruyOJfb80,""Todo un tramado de este seudo Ingeniero, político, de Acuña el narcotrafico fue su rumbo de auge, lo q pasa esos años no existia la tecnología moderna y era detectado todo el lavado de dinero, porq la pregunta es, de donde tanta plata? NARCOTRÁFICO."",2024-04-14T10:37:56Z"												
"César Acuña,HnruyOJfb80,""A cesar Acuña no le encuentran nada por que no hay justicia en el Perú, el ministerio publico esta podrido,  fiscales, jueces y mas son corruptos. Lamentablemente los millones compran voluntades, que investiguen a Cesar Acuña y sus nexos con su hermano el minero ilegal, nos quejamos de tantos atentados en la serrania del departamento La Libertad, investiguen y sabran quienes estan destras de todo eso."",2024-04-13T16:03:54Z"												
César Acuña,HnruyOJfb80,Acuña.es.el.propio.dilblo.en.persona,2024-04-13T01:04:38Z												
"César Acuña,HnruyOJfb80,""Acuña es el ser más feliz de la tierra,por qué el no sabe de dónde viene su fortuna, tiene plata como cancha,pero tampoco sabe  cómo llego tanta plata@."",2024-04-11T22:37:33Z"												
César Acuña,HnruyOJfb80,Y su relaciin con un narco no hablan eso creo lopez,2024-04-11T15:35:28Z												
César Acuña,HnruyOJfb80,Todo el Peru sabe q empezo a robar y coimear desde q le nombraron  alcalde de trujillo......desde empezo fue muy habil y astuto para robar ..igual q alan garcia y montesinos.........alli empezo su ladroneria y delincuencial..siempre esta atras de cada presidente para coimear y mantenerse...con la  universidad q tiene q es una estafa total en el Peru..y se aprovecha de pobreza del pueblo.x q no tiene como pagar una universidad ..y el cobra varato en su universidad...y su ensenñansa .es una verguenza nacional..x saben ni sumar ni multiplicar..no le interesa si los alunnos saben o no...solo le interesa el dinero...miren como salen  los alunnos de la cesar vallejo ..a lo mismo q hacian siempre..no encuentran trabajo.y su propaganda mentirosa...deberian cerrar esa universidad..q no sirve para nada solo para estafar .a los padres de los alunnos..,2024-04-10T13:53:19Z												
César Acuña,HnruyOJfb80,Narco!.,2024-04-10T09:37:56Z												
César Acuña,HnruyOJfb80,Dudo que todo sea limpio su fortuna,2024-04-09T21:48:30Z												
César Acuña,HnruyOJfb80,CREO EMPRENDEDOR SOCIO DE LA COCA.   cola,2024-04-09T16:05:55Z												
César Acuña,HnruyOJfb80,https://youtu.be/54pFjDugh6w,2024-04-07T19:13:32Z												
"César Acuña,HnruyOJfb80,""Pero hay algo que tu todavía no sabes y es que que el padre Cesar Acuña fue narco, estuvo preso por eso y toda la gran """"fortuna"""" que acarreo fue gracias a ello, aparte de que hubiera sido un humilde agricultor y negociante, su padre estuvo involucrado con el narco narcotráfico y fue encontrado con las manos en masa, (ver crónicas periodísticas de la época) fue denunciado y encarcelado. Hay mucho de lavado de activos en su historia y que nadie quiere investigar. En cuanto al hijo Cesar ese tipo tiene una pinta mafioso única. Es muy probable que sus estudios de Ing, químico - cosa que no parece - haya sido fraudulenta. Basta con escucharlo hablar para deducir que este sr nunca estudio nada, no sabe pero ni la formula del agua. no sabe nada de nada. es de misma escuela de Castillo. ambos brutos."",2024-04-07T06:31:00Z"												
César Acuña,HnruyOJfb80,Lo que estudiaron en esa universidad.son burros.diploma bamba.,2024-04-06T15:53:09Z												
César Acuña,HnruyOJfb80,Este enano.pasaba todos los exámenes.das tu cheque y te daba el título.por eso los doctores.son malos.tambien se compró su título.pura corrupcion.delincuencia.,2024-04-06T15:50:57Z												
César Acuña,HnruyOJfb80,Paisano de Castillo!!,2024-04-04T22:16:24Z												
César Acuña,HnruyOJfb80,No necesariamente los que triunfan tienen que ser corruptos o delincuentes. Lamentablemente el conformismo de muchos los hace irse en contra de todos los que llegan a ser algo.,2024-04-04T18:58:08Z												
César Acuña,HnruyOJfb80,Bien dicho!es la verdad joven,2024-04-02T16:57:32Z												
César Acuña,HnruyOJfb80,??asi es paga para borrar su historia y tiene a todo trujillo secuestrado.,2024-04-02T16:56:25Z												
"César Acuña,HnruyOJfb80,""Los peruanos estamos ciegos, o se hacen, bien claro está el lavado de coca, terminaremos como colombianos"",2024-04-02T10:57:52Z"												
"César Acuña,HnruyOJfb80,""Acuña se hizo millonario lavando la plata de los Sánchez paredes, eso es globalmente conocido"",2024-04-02T03:12:13Z"												
"César Acuña,HnruyOJfb80,""Algo que es seguro, los acuña, tienen el lavado de dinero del narcotráfico..."",2024-03-31T21:46:34Z"												
César Acuña,HnruyOJfb80,Cesar Acuña Chivato ?,2024-03-30T04:26:55Z												
"César Acuña,HnruyOJfb80,""Cesar Acuña muy habil para tener apoyo de los gobiernos de turno"												
Para evitar q lo investiguen por la vado de activos y sus vinculos iniciales con el narcotrafico  de los Sanchez Paredes												
Con Castillo quiso amarrarse pq éste amenazó con ingreso gratuito a universidades nacionales												
Fue publico q se ofreció  apoyar a Castillo pero como no lo acepto se le volteo y se confabulo con   el fujimorismo  para tramar , botar a Castillo y pusieron a la traidora dina que como es publico son uña y mugre												
Acuña dina												
"Rodeado de mafiosos coruptos seguira   con sus triquiñuelas para esquivar a la justicia con tanto dinero soborna autoridades y no le pasa nada por que  asi es la politica y la justicia en el Perú."",2024-03-28T18:41:33Z"												
"César Acuña,HnruyOJfb80,""Y con todas estas pruebas el Sr. Acuña deberia estar en la carcel y todos sus bienes confiscados. LA JUSTICA TARDA PERO LLEGA,  la banda delictiva  de Acuña tambien caera en las manos de la justicia."",2024-03-28T14:55:12Z"												
César Acuña,HnruyOJfb80,Dios.... Nos libre d  tener cómo Presidente. al Plata como cancha.,2024-03-27T21:24:27Z												
"César Acuña,HnruyOJfb80,""Acuña es un caudillo como muchos otros """"lideres"""" en el Perú, y no tiene cualidades de verdadero liderazgo. En cuanto a su negocio, para el año 2005/2006 UCV ya tenia mas de 200 mil estudiantes a nivel de todo el país, si cada uno deja S/. 100.00 soles por mes, son una utilidad de 20 millones de soles por mes y eso es 240 millones al año. Y como hoy mentir es lo común, en su declaración jurada dijo que ganaba 22 millones de dólares al año. Es importante ser objetivos y comparar con los otros negocios de """"Educación"""" a nivel de colegio y universidad."",2024-03-27T16:12:44Z"												
"César Acuña,HnruyOJfb80,""SI HAY PRUEBAS, FOTOS INDICIOS Y TODO, EN PERU MANDA PLATA COMO CANCHA"",2024-03-27T15:01:24Z"												
César Acuña,HnruyOJfb80,ESTO ES HISTORIA EL SR. CESAR ACUÑA ES UN NARCOTRAFICANTE ALIADO DE LOS LOPEZ PAREDES LOS MAS GRANDES NARCOTRADICANTES DEL PERÚ. LA MAFIA DE LA DROGA.,2024-03-27T14:59:28Z												
César Acuña,HnruyOJfb80,Mucho polvo blanco,2024-03-23T11:44:27Z												
César Acuña,HnruyOJfb80,Con dinero ilegal crece...,2024-03-23T08:06:40Z												
César Acuña,HnruyOJfb80,ES EL FUJIRRRATA DEL NORTE SE FAVORECE CON LEYES PAR SU UCV.,2024-03-23T04:04:29Z												
"César Acuña,HnruyOJfb80,""es una técnica muy empleada en america catolica hace 150 años. O sea, el tipo convence congresistas y ministros, a lavar dinero en una determiada universidade, el ramo más escogido."",2024-03-23T03:13:32Z"												
César Acuña,HnruyOJfb80,Haz un video del tio millonario de jaime bayli,2024-03-22T05:55:49Z												
"César Acuña,HnruyOJfb80,""No se ajusta a la verdad lo propagado, de tener una academia con muy poco alumnos, los cuales nunca ingresaron a las universidades en puestos meritorios, dicho sea de paso una academia crece cuando sus alumnos ingresan en puestos meritorios a las universidades esto no pasó con esta academia que quedaba en una esquina de la calle gamarra de Trujillo sin embargo de la noche a la mañana obtuvo un tremendo terreno en la avenida el arco urbanización Buenos Aires de dónde tanto ingreso ??"",2024-03-21T16:30:34Z"												
"César Acuña,HnruyOJfb80,""Lavado de activos, eso es pantalla."",2024-03-21T00:23:58Z"												
César Acuña,HnruyOJfb80,El camino recorrido por César Acuña es oscuro.,2024-03-20T21:10:59Z												
César Acuña,HnruyOJfb80,Ahora en su universidad mayoría profesionales mediocres ingresan pagando y  senedu lo negociando apoyar las estatales,2024-03-20T20:26:20Z												
César Acuña,HnruyOJfb80,En Trujillo los antiguos dice con fachada de academia hizo lavado activos lo que mueve dinero en Trujillo muchos empresarios lo comentan,2024-03-20T20:25:06Z												
César Acuña,HnruyOJfb80,la investigación debe darse una historia oscura,2024-03-20T02:56:02Z												
César Acuña,HnruyOJfb80,Bien RARA la forma como este personaje se ha hecho de dinero. Comenzando por el hecho de que como obtuvo el terreno y el dinero para construir los varios locales de la universidad y lo extraño de que no hay evidencia de su paso por la universidad esa puede ser la razón por la que no SABE NI HABLAR porque hasta los que son malos estudiantes algo les queda de cultura.,2024-03-20T01:47:34Z												
César Acuña,HnruyOJfb80,Investiguen según la verdad el se inicio en la academia CABRERA QUE ERA LA ÚNICA EN TRUJILLO LUEGO EL POSTULA AL CONGRESO POR IZQUIERDA UNIDA DEL DR BARRATES LINGAN  CON EL N 2 PERO NO GANO SOBRE EL ORIGEN DE SU DINERO HAY MUCHAS VERSIONES Y FUE DENUNCIADO POR SU EX ESPOSA,2024-03-19T20:28:40Z												
"César Acuña,HnruyOJfb80,""Salí con un trujillano, en esa época César Vallejo era solo conocida en los conos y el siempre me decía q todo eso era d la droga, q a su familia le constaba??. Siempre se me hacía raro q lo dijera con tanta convicción. ???????"",2024-03-19T14:13:51Z"												
César Acuña,HnruyOJfb80,yo personalmente conozco un señor q me dijo q acuña es un narco xq antges no tenia nada y de un dia a otro tenia mucho dinero lo q pasa es q es amigo y x beneficios  mutuos con politicos nadie se mete con el o no lo investigan a fondo y ps se hacen la vista gorda xq el tambien ha pagado mucho dinero en sobornos,2024-03-19T04:38:35Z												
"César Acuña,HnruyOJfb80,""Acuña : """"solo se que nada se """""",2024-03-19T02:13:25Z"												
César Acuña,HnruyOJfb80,Acuña es un burro no sabe expresarse sus titulos son falsos,2024-03-19T01:37:42Z												
César Acuña,HnruyOJfb80,Este tío está en saco  de Joakin Ramírez.. Se nota q lavó dinero.. Y q los fiscales de ese tiempo no investigaron x algún dinero q recibieron.. Pero no es tarde y q lo investiguen.. Xq esta de espaldas al pueblo.. Apoya la corrupción Congresal,2024-03-19T00:14:46Z												
César Acuña,HnruyOJfb80,De enchufe TV a tener su propio canal de YouTube ??,2024-03-18T17:53:52Z												
César Acuña,HnruyOJfb80,Es lavado de activo,2024-03-18T17:52:12Z												
César Acuña,HnruyOJfb80,Se hizo millonario lavando queso,2024-03-18T17:25:14Z												
César Acuña,HnruyOJfb80,K no va hacer millonario sacando leyes a su favor  de la noche a la mañana tenía millones saqueando al pais,2024-03-18T16:48:36Z												
César Acuña,HnruyOJfb80,LAVADO DE ACTIVOS O SE HACCEN LOS TONTOS?,2024-03-18T02:12:01Z												
César Acuña,uEN8NQQl_js,POR FAVOR GENTE DE LA LIBERTAD Y EN GENERAL... LOS ACUÑA NUNCA MÁS!????? NO ENTIENDO PORQUE SIGUEN VOTANDO POR ESE PARTIDO INCONMENSURABLEMENTE CORRUPTO Y PODRIDO!,2025-06-19T23:38:10Z												
César Acuña,uEN8NQQl_js,INDISCUTIBLE PROSPECTO PSRA PRESIDENTE  DEL PERU,2025-06-11T19:31:00Z												
César Acuña,uEN8NQQl_js,Fuerza y desicion para alejar al pitufo de Peru mandalo de viaje aqui,2025-05-27T13:09:45Z												
César Acuña,uEN8NQQl_js,Señor.   Antes.  De.   Pensar   a.  La.  Presidencia.  Paga. Tu.   Deudas.  De.   Expuestos.   De.  Tu.    S.    Expuestos,2025-05-26T11:00:02Z												
César Acuña,uEN8NQQl_js,Rafael como va distruir a su padre cesar acuña y su madre dina es mentiroso chancho era contra manifestantes,2025-05-25T02:08:07Z												
César Acuña,uEN8NQQl_js,Los dos son de la misma condición.,2025-05-24T11:27:56Z												
César Acuña,uEN8NQQl_js,Destruye a ese pitipan corrupto buena Porky sigue adelante,2025-05-23T19:49:59Z												
César Acuña,uEN8NQQl_js,Presidente sr Aliaga,2025-05-21T00:52:55Z												
César Acuña,uEN8NQQl_js,Falta la pista del tren en VES en separadora esta una desgracia desde ke pusieron el tren,2025-05-19T03:28:42Z												
César Acuña,uEN8NQQl_js,Ambos inutiles weones que sé pelean no mas.,2025-05-18T16:24:45Z												
"César Acuña,uEN8NQQl_js,""Jajjajajajjaa """" Porky deslumbro"""" jajajajajajaja que ilusos son los limeños y encima quiere ser presidente pobre Perú"",2025-05-18T16:16:44Z"												
César Acuña,uEN8NQQl_js,Si el chatarrero es un genio que vaya a las ciudades fronterizas con sus aplaudidores y convierta en potencia a esos pueblos abandonados.,2025-05-18T13:53:13Z												
César Acuña,uEN8NQQl_js,?????????????????????????????????????????????????????????????? RLA. PRESIDENTE DEL PERU. CON NUESTRO DIOS PADRE SIEMPRE PRIMERO ?????????DIOS LO BENDIGA.  ??????????????????????????????????????????????????????????????????????????????,2025-05-18T13:04:36Z												
César Acuña,uEN8NQQl_js,Como puede ver hente tan estupida en voyar por un tatero asqueroso.,2025-05-18T09:21:50Z												
"César Acuña,uEN8NQQl_js,""NO RESPONDAN A LOS QUE ESTÁN OFENDIENDO A ESTE CANDIDATO. LO ÚNICO QUE QUIEREN ES GENERAN POLÉMICA. SI ELLOS LOGRAN GENERAR POLÉMICA, GANAN. INCLUSO LES AYUDAS A QUE LES PAGUEN MÁS, ¡¡¡¡ COBRAN POR CANTIDAD DE COMENTARIOS QUE GENERAN !!!! SOLO MIRA Y PASA. "												
												
NO LES DES DE COMER A ESTOS HAMBRIENTOS, MERCENARIOS A SUELDO. MÁS POLÉMICA, MÁS GANANCIA PARA ELLOS. ¡¡¡¡ SI LOS DEJAS EN VISTO, SE MORIRÁN DE HAMBRE !!!!												
												
"¡SI GENERAN POLÉMICA ELLOS SALEN GANANDO!"",2025-05-18T07:15:14Z"												
"César Acuña,uEN8NQQl_js,""D.Rafael López Aliaga sus gestiones son de aliado en hidrología Lima tiene ríos aguas subterráneas potable pero políticos corruptos decían no tienen agua potable mintiendo...así por vigilancia de precisión use drones con cambios hablé con Zelensky de Ukrania  sean drones que te den coordenadas de focos de narcos y mineras ilegales sin"												
"Corteza selvática dejando al descubierto  con un añadido de detectar focos de armas. Cocamazerada explosivos en todo Putumayo Pataz pro Maldonado Conga que no le tiemble la mano sellar minas ilegales con drones explosivos sellarlos toque de queda y cerrar la minera de Pataz temporalmente y destruir las mansiones en zona rural son depósitos de oro y criminales. Prisión a Acuña y severo control al gobierno. Esta sobornando candidatos y comprando por participar con el hermano de la"",2025-05-18T06:22:16Z"												
César Acuña,uEN8NQQl_js,Y las motos?...el tren Chat...ar..rra...x la delincuencia en su conjunto...POBRE PERU,2025-05-17T18:45:26Z												
César Acuña,uEN8NQQl_js,Este ladron de porky da risa ??,2025-05-17T08:23:03Z												
César Acuña,uEN8NQQl_js,Que pena leer a mucha gente ignorante y desinformada por eso el PERU esta como esta !!! El peor enemigo de un peruano es otro Peruano !! Si hacen obras por que hacen si no hacen por que no hacen !! Dejen trabajar a este buen Peruano con obras y no de floro!!!!,2025-05-17T07:05:20Z												
"César Acuña,uEN8NQQl_js,""ES SÓLO FLORO PARA QUE EL PUEBLO PERUANO SE LA CREE,.. SON DE LO MISMO, SINÓ QUE ÉSA ACTUACIÓN ES PARA CONFUNDIR AL PUEBLO PERUANO,..NO CAIGAMOS EN LO MISMOOO,...??????"",2025-05-17T04:14:36Z"												
"César Acuña,uEN8NQQl_js,""Viva potencia mundial, trabado mental ofende, amenaza, a todo el mundo nunca ve el tronco qué tiene en el ojo."												
"Otro campeon de los memes."",2025-05-17T00:08:20Z"												
"César Acuña,uEN8NQQl_js,""¿Qué opinan de que el S0dalici0 (organización acusada de mas de 30 casos de peder4sti4, est4f4 y de l4vad0 de 4ctiv0s), haya transferido 36 inmuebles a porky (acus4d0 de l4vad0 de activ0s) y que este señor defienda a Cipri4ni (acusado de peder4sti4) y al 0pus D3i (asociación a la cual pertenece también acusada varias veces de casos de peder4sti4) y a chib0lin (acusado de pr0x3netism0) ¿todos los amigos de Porky tienen sex0 con niñ0s y otros h0mbres menos el? ¿no? ¿o mucha ingenuidad de mi parte???????"",2025-05-16T21:56:38Z"												
César Acuña,uEN8NQQl_js,Entre ratas haciendo el ridiculo.,2025-05-16T21:35:06Z												
César Acuña,uEN8NQQl_js,Lamentablemente nuestro país está siendo gobernado por puro ABOGADOS (AS) como la actual Presidenta. Por eso estamos. DE FULL DELINCUENCIA.,2025-05-16T18:58:36Z												
"César Acuña,uEN8NQQl_js,""Ese miserable a destruido a mi tierra ,trujillo es tierraxde nadie  el norte esta impregnado de parásitos ladrones es un asco"",2025-05-16T18:54:32Z"												
César Acuña,uEN8NQQl_js,*HAY QUE ACABAR LA CORRUPCION PORKY DICE LA VERDAD YA ESTO ES DEMASIADO SOLO SE LLENAN LOS BOLSILLOS Y EL PUEBLO SIN AGUA Y ELLOS LLENANDOSE LOS BOLSILLOS Y PONIENDO A SUS AMIGUITAS Y AMIGUITOS PARA SEGUIR ROBANDO COMO DICE PORKY BASTA DE CORRUPCION TIENEN QUE APOYARLO Y SI PORKY HABLA ES POR QUE SABE MUCHO DEL CHATO SEGUN PORKY SI EL LO DICE ES POR QUE SABE*,2025-05-16T16:26:02Z												
"César Acuña,uEN8NQQl_js,""Acuña es testaferro de narcos "												
"Porkys si llega a ser presidente del Perú que le quite la Universidad y todas sus propiedades y enviarlo a El Salvador donde Bukele"",2025-05-16T14:52:49Z"												
César Acuña,uEN8NQQl_js,Porky presidente,2025-05-16T13:27:25Z												
César Acuña,uEN8NQQl_js,Jueces y fiscales corruptos FUERA PUEBLO MARCHA,2025-05-16T10:38:56Z												
César Acuña,uEN8NQQl_js,Paga tus impuestos ??????,2025-05-16T04:31:21Z												
"César Acuña,uEN8NQQl_js,""No jodas panson estás en canpañael pueblo te conoce también eres un corrupto evasor de impuestos aliado del fujimontesinismo ladrón , ratas nunca más."",2025-05-16T02:09:31Z"												
César Acuña,uEN8NQQl_js,Porky presidente 2026,2025-05-15T22:33:40Z												
César Acuña,uEN8NQQl_js,NO TIENEN SANGRE EN LA CARA DE JEBE,2025-05-15T18:42:00Z												
César Acuña,uEN8NQQl_js,Acuña un narco caudillo dueño del Congreso,2025-05-15T18:41:33Z												
César Acuña,uEN8NQQl_js,??Pobre d i a b l o no nos engañas??,2025-05-15T15:50:26Z												
César Acuña,uEN8NQQl_js,Porque miserable lima se desangra y el no hace nada es un halcoholico de porqueria,2025-05-15T14:10:30Z												
