Candidato,VideoID,Comentario,FechaHora												
"Nadie va votar por esta señora,el pez por la boca muere."",2021-03-10T19:44:02Z"												
"Verónika Mendoza,WciqVpmKduo,""Una persona que honra sus valores, no debe dudar ni mucho menos tratar de enmascarar sus respuestas, no es confiable."",2021-03-10T17:11:36Z"												
"Verónika Mendoza,WciqVpmKduo,""Ta madre la tia Vero siempre se va por la tangente, tiene que decir mil cosas en lugar de decir """"fue un mal gobernante""""."",2021-03-09T18:50:03Z"												
Verónika Mendoza,WciqVpmKduo,compañeros DEL PERU piensen bien en esta sr esta será su chaves de Perú,2021-03-09T05:09:05Z												
"Verónika Mendoza,WciqVpmKduo,""En RESUMEN : APOYA A HUGO CHAVEZ Y SU POLITICA SOCIALISTA, LISTO .... NO VOTAR NUNCA POR ELLA. ESTA MUJER ES UN PELIGRO PARA EL DESARROLLO DEL PERÚ...."",2021-03-08T23:38:52Z"												
Verónika Mendoza,WciqVpmKduo,https://youtu.be/-0ujbmEVwZY,2021-03-07T18:58:28Z												
Verónika Mendoza,WciqVpmKduo,Uno tiene dudas de por quién va a votar pero creo que hay tener claro de por quién no votar.,2021-03-07T08:32:52Z												
"Verónika Mendoza,WciqVpmKduo,""Según ella apartir del min 2:15 en adelante cita que si fue un buen gobierno el de chavez pero que recibieron boicot de otros países, con esto lo dice todo la socialist Franco peruana"",2021-03-06T15:27:55Z"												
Verónika Mendoza,WciqVpmKduo,No contesta,2021-03-05T13:40:52Z												
Verónika Mendoza,WciqVpmKduo,tan difícil es responder que maduro y chavez llevaron a la miseria a venezuela,2021-03-03T20:24:07Z												
"Verónika Mendoza,WciqVpmKduo,""Vete a Francia Veronica, Vete!!!"",2021-03-02T21:11:31Z"												
Verónika Mendoza,WciqVpmKduo,Esperemos que pierdas porque no queremos ser como Venezuela,2021-03-02T19:58:36Z												
Verónika Mendoza,WciqVpmKduo,HABLA LA MISMA BASURA DE CHÁVEZ,2021-03-01T14:20:10Z												
Verónika Mendoza,WciqVpmKduo,Que mentirosa...merci,2021-02-28T22:52:42Z												
"Verónika Mendoza,WciqVpmKduo,""https://youtu.be/U5Y9PKo_dKI"												
"Igualita a Hugo Chavez ..."",2021-02-28T22:45:34Z"												
Verónika Mendoza,WciqVpmKduo,Vomitiv4 ?????? está terruc4... Y nunca respondió si Chávez fue buen presidente o no... Que diga si es un dictador claramente...,2021-02-28T20:07:44Z												
"Verónika Mendoza,WciqVpmKduo,""Cómo diabl0s va a querer al Perú, como un país diferente a Venezuela o Cuba, si aplica las mismas políticas progr3-zurd4s soci4l-comunist4s?... Cree que los peruanos somos idiotas... Ella lo dice para embaucar a la gente, papá la gente con sentido común sabe que Cháv3z y Madur0 son dictadorzuel0s y no quieren que la vinculen para no perder votos... Igual que Chávez, cuando era candidato, dijo que Fidel Castro era un dictador y miren con lo que salió cuando ganó las elecciones de Venezuela. Los izquierdist4s son mentirosos e hipócritas, no se les cree nada... Sino miren a Cháv3z y en Perú a VIZCARRAT4"",2021-02-28T20:04:42Z"												
Verónika Mendoza,WciqVpmKduo,De Soto presidente ??,2021-02-25T19:50:57Z												
"Verónika Mendoza,WciqVpmKduo,""Verónica, eso no te preguntaron, la respuesta es si o no!!!"",2021-02-24T23:51:59Z"												
"Verónika Mendoza,WciqVpmKduo,""Resumen"												
Periodista: Hugo Chavez fue un buen presidente?												
"VM: bla bla bla...."",2021-02-23T23:10:03Z"												
Verónika Mendoza,WciqVpmKduo,Siempre evade las preguntas sobre su pasión por chavez..,2021-02-23T12:15:52Z												
Verónika Mendoza,40oocsATsGE,Y ya sabe que Bolivia está en  quiebra?,2025-05-26T10:57:16Z												
Verónika Mendoza,40oocsATsGE,Sra.Veronika Mendoza Solo tu vas aResolberq Peru esta pasanda  en malos Momentos por Falta Capasidad moral P0litica por UD. Tiene Sfisiente Savedoria Inteligente para acabar con esta Racha De Corrupcion y No Pagarlo esos suedo Vitalicio q ya se pagaron por Millones en Dlares ay q preguntar dde Alan Garcia TToledo Humala P.p..K. Keiko y sus Hermanos y a sus Bancadas.Delicuentes Rateros Corruptos.,2022-07-26T22:15:35Z												
Verónika Mendoza,40oocsATsGE,Nacionalizar = Expropiar,2021-11-20T03:50:48Z												
Verónika Mendoza,40oocsATsGE,Esta mujer es burra e ignorante ni siquiera Lee los contratos de vendedora de comida rápida en Estados Unidos a candidata presidencial dónde estamos? Secretaria de Nadine Heredia usted no trabaja de que vive???,2021-10-04T18:49:26Z												
Verónika Mendoza,40oocsATsGE,Estas por tu pedaso veronica,2021-10-03T04:28:31Z												
Verónika Mendoza,40oocsATsGE,Puro palabreo,2021-10-02T16:35:57Z												
Verónika Mendoza,40oocsATsGE,El Estado empresario es una ?????????? lo que van a provocar es un multasa para el país y ser unos apestados para la inversión. Populismo barato!!!,2021-10-02T01:15:26Z												
Verónika Mendoza,40oocsATsGE,Jajaja no copie solo plagiee,2021-10-01T19:40:44Z												
"Verónika Mendoza,40oocsATsGE,""VEN LO QUE QUIEREN VER. MIENTRAS LOS QUE TUVIERON EDUCACION OPORTUNIDADES Y VIVEN COMODAMENTE VEN MALAS INTENCIONES EN TODO LO QUE HAGA EL OBIERNO POR ACABAR CON ANEMIA INFANTIL Y DEFIENDEN """"GRATIS"""" COMO ABOGADOS LOS INTERESES DE EMPRESAS FAVORECIDAS POR CORRUPTOS. LAS PROVINCIAS VEN CON ESPERANZA A UN GOBIERNO DEL PROFESOR CAMPESINO QUE LOS INCLUYA AL EXITO QUE LOS RESCATE DEL ABANDONO Y DE SU NIVEL DE DESNUTRICION SOLO COMPARADO CON AFRICA."",2021-10-01T19:09:14Z"												
"Verónika Mendoza,40oocsATsGE,""Que la señora diga de donde se sacarán los 30000 millones de dólares que va a costar la nacionalización, parece que no se entera que nada es gratis"",2021-10-01T05:17:24Z"												
"Verónika Mendoza,40oocsATsGE,""La sirvienta de nadin,jajaja"",2021-10-01T02:19:50Z"												
Verónika Mendoza,40oocsATsGE,Vas a nacionalizar algo que ya es nuestro??? Obviamente plantean expropiar,2021-09-30T22:32:40Z												
"Verónika Mendoza,40oocsATsGE,""Ecxelente queremos la nacionalizacion del gas como en bolivia, gas barato para todos los peruanos"",2021-09-30T21:19:57Z"												
"Verónika Mendoza,40oocsATsGE,""Básicamente expropision, estuve buscando cual es la diferencia entre nacionalizar y expropiar y lo único que sale es humala tratando de calmarnos antes de darse cuenta que no servía de nada."",2021-09-30T17:25:42Z"												
Verónika Mendoza,40oocsATsGE,Vamos por buen camino  que bueno presidente castillo no me defrauda sigue así ????????????,2021-09-30T14:05:04Z												
Verónika Mendoza,40oocsATsGE,Muy bien Verónica nacionalizar  sigue comunicando hasi para que todos puedan escuchar la verdad y no esa prensa GOLPISTA y DOLIDA ????,2021-09-30T14:03:43Z												
Verónika Mendoza,40oocsATsGE,Qué bestia es esta mujer,2021-09-30T03:13:41Z												
"Verónika Mendoza,40oocsATsGE,""QUIENES SON LOS ENCARGADOS DE MASIFICAR ES EL GOBIERNO , O HICIERON ALGUN CONTRATO CON LA MISMA EMPRESA QUE EXPLOTA EL GAS ???...SI NO SE A MASIFICADO , ES POR CULPA DE LOS QUE HAN TENIDO A SU CARGO ESTOS TRABAJOS REGIONALES , NACIONALES..ETC , ETC..."",2021-09-30T02:46:06Z"												
"Verónika Mendoza,40oocsATsGE,""MASIFICAR EL GAS , NO ES IGUAL QUE NACIONALIZAR....!!!!"",2021-09-30T02:44:16Z"												
"Verónika Mendoza,40oocsATsGE,""Está casta es de lo peor solo quieren llevarse el dinero nadie va quiere retroceder, el estado no es buen administrador NO A LA NACIONALIZACION DE INDUSTRIAS PRIVADAS QUE PROVEEN TRABAJOS A LOS PERUANOS"",2021-09-30T01:28:21Z"												
Verónika Mendoza,40oocsATsGE,.???????  MÁS CONOCIDA. POR. PUCA Y CERRON. COMO LA PAYASA...?????????????????????????,2021-09-29T18:37:44Z												
Verónika Mendoza,40oocsATsGE,Asnaaa,2021-09-29T18:25:57Z												
"Verónika Mendoza,40oocsATsGE,""jajajajajja Verónica Mendoza solo puede convencer a gente que son recontra ignorantes!! ese juego de palabras barata de quinta, nadie se lo cree!!!!!"",2021-09-29T16:16:58Z"												
Verónika Mendoza,40oocsATsGE,ERES MALA CON TU PAÍS  COMO APOYAS A ESTE  GOBIERNO MAFIOSO PARA DESTROZAR EL PAÍS TUCA DESGRACIADA .????????,2021-09-29T14:52:12Z												
Verónika Mendoza,40oocsATsGE,Veronica. La Vocera de Los Corruptos de los Dinamicos del centro,2021-09-29T14:39:22Z												
"Verónika Mendoza,40oocsATsGE,""Lo que nunca entenderé es porque los periodistas casi nunca replican o desmienten a los políticos en sus declaraciones, será que estos periodistas no están preparados?  Es increíble.  Lo peor es que muchas personas que la escuchan le creen ,  sobre todo los que botaron por el SOMBRERO."",2021-09-29T14:28:11Z"												
"Verónika Mendoza,40oocsATsGE,""VERONIKA LA DE LA LIBRETA DE NADINE DE LOS PAGOS DE ODEBRECHT, LA QUE NO TRABAJA EN NADA,, LA DEL CONSTANTE FRACASO, UNA UZQUIERDISTA MEDIOCRE... AHORA SE HACE LA DIRECTORA? "												
"VACANCIA DE PEDRO CASTILLO, SOMOS 30 MILLONES DE PERUANOS Y NO PODEMOS IRNOS A LA POBREDUMBRE POR UNOS ENFERMOS MENTALES COMUNISTAS... LA FISCALIA DE ZORAIDA AVALOS Y DE TELLO EL ANTICORRUPCIÓN DEBERIAN DE RENUNCIAR Y QUE EL CONGRESO QUITE MUCHAS ATRIBUCIONES QUE ESTE ENTE DEL ESTADO A DEMOSTRADO QUE NO ESTA A LA TALLA DE LAS CIRCUNSTANCIAS YA QUE DE ELLOS ES LA RESPONSABILIDAD DE HABER DEJADO ACTUAR A CERRON Y VIZCARRA SIN HABERLOS PUESTO EN PRISION PREVENTIVA Y CON ELLO HAN PROPICIADO MUCHO DAÑO E INESTABILIDAD AL PAIS."",2021-09-29T14:14:17Z"												
Verónika Mendoza,40oocsATsGE,No es robo... es hurto,2021-09-29T13:44:18Z												
Verónika Mendoza,40oocsATsGE,Ese gas es ya Nacional..ese gas es del Peru..es la reparticion q es el problema..o sea del estado..no de la compania q es privada...ellos pagan ..es el Estado IGNORANTES..q es el q tiene q saber como distribuir..seran tan brutos estis..,2021-09-29T13:40:17Z												
Verónika Mendoza,40oocsATsGE,Bien dicho  que buena candidata  de una vez hay que nacionalizar el gas  como bolivia  pilas presidente pedro castillo,2021-09-29T13:20:01Z												
Verónika Mendoza,40oocsATsGE,Q  se vaya a la mda esta mujer,2021-09-29T13:06:51Z												
Verónika Mendoza,40oocsATsGE,Arranca terruca ya pareces graduada de la católica con tanto enredo.,2021-09-29T12:08:26Z												
Verónika Mendoza,40oocsATsGE,La vocera de PL? Le guiña el ojo a El Amo,2021-09-29T12:03:04Z												
"Verónika Mendoza,40oocsATsGE,""Lee la Constitución ,los recursos naturales son de la Nación ,de todos los peruanos,"												
Nacionalizar lo nacionalizado?												
Los tubos lo hace el estado, 												
El Estado ya recibe el 65%  x q el Estado es 												
"Incapaz ,,los comunistas son vagos"",2021-09-29T12:00:48Z"												
"Verónika Mendoza,40oocsATsGE,""Jaja quién lo cree , así como Acuña no es copia es plagio"",2021-09-29T11:38:15Z"												
"Verónika Mendoza,40oocsATsGE,""PERÚ PIDE LA VACANCIA DEL COBARDE  MANDATARIO PEDRO CASTILLO... VLADIMIR CERRÓN ES UN TERRORISTA CRIMINAL CORRUPTO QUE DEBE ESTAR ENCERRADO EN LA CÁRCEL, AL IGUAL QUE LOS TERRORISTAS GUIDO BELLIDO, GUILLEMO BERMEJO Y TAMBIEN IBER MARAVÍ, LOS CUATRO GINETES DEL APOCALIPSIS JODEN AL PERÚ ECONOMICAMENTE."",2021-09-29T06:04:23Z"												
Verónika Mendoza,40oocsATsGE,Tarada exportar ? si hacen eso no van a tener para el pueblo los inversionistas no pondran dinero para seguir extrayendo el gas todo eso no es gratis cuesta seguir invirtiendo todos los annos para q siga produciendo y si no lo creen pregunten a Bolivia como esta ahora se gastaron lo que extrayenron antes q entre Evo el Narco se gasto en el populismo ahora se le viene todo a abajo a Bolivia xk las reglas de juego ha cambiado donde los inversionistas solo reciben migajas . Entonces las companias no mas quieren invertir,2021-09-29T06:02:52Z												
"Verónika Mendoza,40oocsATsGE,""Bravo Vero, Vero Mendoza Presidente 2026!!"",2021-09-29T04:09:36Z"												
Verónika Mendoza,40oocsATsGE,ESTA MAMONAZA AL PALO,2021-09-29T03:16:37Z												
Verónika Mendoza,40oocsATsGE,veronika mendoza es bonita,2021-09-29T03:08:30Z												
Verónika Mendoza,40oocsATsGE,bien veronika mendoza,2021-09-29T03:03:41Z												
Verónika Mendoza,40oocsATsGE,Miente nacionalizacion es un tipo de expropiacion que abarca aun mas que una expropiacion simple. Deberia leer antes de hablar cosas inciertas.,2021-09-29T02:21:44Z												
"Verónika Mendoza,40oocsATsGE,""Este esquema de nacionalización es similar al boliviano y garantiza pan para hoy y hambre para mañana. El premier Bellido está cometiendo el mayor error en lo que va de su gestión, debe ser removido de su cargo antes que el daño sea mayor. Si Castillo no lo destituye comprueba de manera contundente que no tiene liderazgo ni capacidad para gobernar."",2021-09-29T02:18:45Z"												
Verónika Mendoza,40oocsATsGE,esta borrica ya es un cadaver politico,2021-09-29T01:28:26Z												
"Verónika Mendoza,40oocsATsGE,""Verónika Mendoza: yo estoy a favor de matar, no de asesinar..."",2021-09-29T00:52:17Z"												
Verónika Mendoza,40oocsATsGE,Como ..? ??,2021-09-29T00:49:20Z												
Verónika Mendoza,40oocsATsGE,Bien Veronika... Asi se habla,2021-09-29T00:31:16Z												
"Verónika Mendoza,40oocsATsGE,""Y esta bruta Comunista, siempre haciendo lo que los comunistas hacen, que tal ejemplo de Venezuela y el vago de Evo en Bolivia."",2021-09-29T00:22:34Z"												
Verónika Mendoza,40oocsATsGE,Eso se llama expropiar ! Se hace la tonta o mejor dicho burra !!,2021-09-28T23:56:31Z												
Verónika Mendoza,40oocsATsGE,??????????????????...no sé desplomó se ...,2021-09-28T23:44:46Z												
Verónika Mendoza,40oocsATsGE,Y QUE CHUCHA QUIEREN RENEGOCIAR?,2021-09-28T23:42:25Z												
Verónika Mendoza,40oocsATsGE,Pesé esta tipa era inteligente como  mujer.,2021-09-28T23:25:09Z												
Verónika Mendoza,40oocsATsGE,Estan hechando al tacho muy rápido la poca confianza ganada por la izquierda en mucho tiempo.,2021-09-28T23:09:09Z												
"Verónika Mendoza,40oocsATsGE,""La idea es buena siempre y cuando los Peruanos encargados y del estado,  puedan hacer el trabajo, que hasta ahora han probado unos incapaces, comenzando con el gobierno y sus compinches (con excepciones). Veronica ha perdido credibilidad. Mientras no creen otro PetroPeru para que se robe  la plata del país sin hacer nada."",2021-09-28T23:07:22Z"												
Verónika Mendoza,40oocsATsGE,Primero hay que conseguir un estado y gobernadores que no dejen que se roben la plata que pagan estas empresas,2021-09-28T22:51:36Z												
Verónika Mendoza,40oocsATsGE,Que roja es esta,2021-09-28T22:46:56Z												
Verónika Mendoza,40oocsATsGE,No quiere opinar porque sabe que lo perjudica a tal Castillo terrones.,2021-09-28T22:46:12Z												
"Verónika Mendoza,40oocsATsGE,""Como le gusta a muchos que está señora les meta el dedo al culo."												
Nunca dice nada concreto, real, posible. Pura paja mental o mentiras.												
"El 40% de la electricidad que TODOS los peruanos consumen es producida con gas natural de Camisea."",2021-09-28T22:34:14Z"												
"Verónika Mendoza,40oocsATsGE,""Más metiche. Ya está cantado, ella tendrá cargo, será la traductora del profe"",2021-09-28T22:27:06Z"												
Verónika Mendoza,40oocsATsGE,Yo estoy deacuerdo renegociar el gas,2021-09-28T22:26:00Z												
"Verónika Mendoza,40oocsATsGE,""Pero gas siempre asi muy caro en el perú , solo nos queda 20 años y se acaba de donde va a salir el gas despues"",2021-09-28T22:25:36Z"												
Verónika Mendoza,40oocsATsGE,Pobre diabla!,2021-09-28T22:24:11Z												
Verónika Mendoza,40oocsATsGE,Aquien representa esta hipocrita,2021-09-28T22:22:46Z												
"Verónika Mendoza,40oocsATsGE,""Muéstrate más quién eres  señora Verónica Mendoza,,  para que sepan que nunca deben votar por ti."",2021-09-28T22:22:27Z"												
"Verónika Mendoza,40oocsATsGE,""Dentro de las ideas trasnochadas de esta señora, la pregunta es: ¿A que porcentaje de la población representa? logró pasar la valla electoral por poco, pues solo alcanzó el 4,8% de los votos válidos, obteniendo solo cuatro curules. El problema es que dicho número de escaños los haría perder su inscripción como partido politico."",2021-09-28T22:18:54Z"												
Verónika Mendoza,40oocsATsGE,LA CORRUPTA DE TERRONICA ESTA TRAS EL ROBO DE NUESTROS RECURSOS ES LA HORA DE VACAR ESTOS CORRUPTOS,2021-09-28T22:15:15Z												
Verónika Mendoza,40oocsATsGE,Nose cayó se desplomó así como sus oportunidades de ser presidenta,2021-09-28T22:12:33Z												
"Verónika Mendoza,40oocsATsGE,""No paras de arrastrarte ,verdad?  Ahora te subes al coche nuevamente. No que feminista y en defensa de las minorías sexuales? Eso quiere decir que Castillo también se subira al coche porque no tiene liderazgo y solo hace lo que le dices tú o Cerrón"",2021-09-28T22:05:50Z"												
Verónika Mendoza,40oocsATsGE,Para que todos tengan gas es trabajar las conecciones necesarias para eso.... Empresas privadas lo deben realizar pero si lo nacionaliza n todo al final ningún empresario quiere invertir en Perú,2021-09-28T22:04:21Z												
"Verónika Mendoza,40oocsATsGE,""Si se tratase de expropiación, pensaría que es malvada por sus actitudes comunistas. Pero como se trata de nacionalización, tengo que pensar que es una imbécil porque no ha aprendido que los estados son malos gestores. En fin, allí está como un perro a por las sobras del banquete de sus camaradas extremistas…"",2021-09-28T21:57:56Z"												
"Verónika Mendoza,40oocsATsGE,""Y pensar que muchos zurdos progresistas creían en Mendoza."												
												
"Ya sin el disfraz de mujer progresista que representaba a las minorías. Desnuda en toda su ideología retrógrada."",2021-09-28T21:54:57Z"												
Verónika Mendoza,40oocsATsGE,Nacionalización es lo mismo que expropiar!,2021-09-28T21:54:01Z												
"Verónika Mendoza,40oocsATsGE,""Todo eso ya se hizo en venezuela y bolivia. Los dos con terribles resultados para la población. Aunque uno peor que el otro. "												
Su discurso es anacrónico u retrógada. 												
"Los más vulnerables serán los más perjudicados."",2021-09-28T21:53:45Z"												
"Verónika Mendoza,40oocsATsGE,""Es curioso como a los peruanitos nos atraen los virajes extremistas. De la corrupción mercantilista de la extrema derecha brut@ y achorada hacía la corrupción estatista de la extrema izquierda brut@, retrógrada y primariosa. Y todo por ignorantes, porque no pasamos de aplaudir como morsas al primer caudillo que nos prometa un poco de pescado."												
												
"Ahí está Bolivia precisamente del ejemplo que suelen poner, años después de las renegociaciones impulsadas por Morales, y cuyos efectos han sido la total pérdida de incentivos para realizar nuevas exploraciones por el recorte de utilidades a los inversionistas, ofreciendo ahora todas las condiciones e incentivos para atraer nuevamente inversionistas, viéndose obligados a """"competir por nuevos capitales en un contexto global que está en transición energética y con menos empresas dispuestas a invertir en hidrocarburos"""", y mientras tanto en nuestro país, el inepto primer ministro, auspiciado por su amo Cerrón, y secundado por sus hordas de ayayeros como Mendoza, haciendo precisamente lo opuesto, en perjuicio de nuestro país. Irónico ¿no?"",2021-09-28T21:51:53Z"												
"Verónika Mendoza,40oocsATsGE,""Nacionalizar es el proceso por el cual el Estado se hace propietario de la empresa y la materia prima, yacimiento o gas que explota, sin ninguna reparación o indemnización. En cambio, expropiar es la manera legal de volverse propietario del bien pagando una indemnización o justiprecio. Suena bonito en boca de un populista y más bonito de boca de un comunista. Pero la realidad dista mucho de las mentiras con que estos izquierdistas de pacotilla suelen conducirse. Ladrones y mentirosos."",2021-09-28T21:46:07Z"												
Verónika Mendoza,40oocsATsGE,por eso jamás ganará esta mujer,2021-09-28T21:43:27Z												
"Verónika Mendoza,40oocsATsGE,""Y está quien es?? Ganó las elecciones.??: Que vergüenza ese castiburro no puede ni hablar, pésimo que feo sigue quedando. VACANCIA YAAAA"",2021-09-28T21:43:24Z"												
"Verónika Mendoza,40oocsATsGE,""Todos los comunistas son tan ignorantes, que hablan webaas sin pies ni cabeza"												
"BURROS DE ??????????"",2021-09-28T21:43:10Z"												
"Verónika Mendoza,40oocsATsGE,""De no se cayo se desplomo"												
"Quitarle a alguien su propiedad privada es expropiar.....no dicen nada como se va a asumir la indemnizacion a pluspetrol y la fuga de inversiones q va a traer eso"",2021-09-28T21:42:22Z"												
Verónika Mendoza,40oocsATsGE,Está más loca está tuca,2021-09-28T21:41:22Z												
"Verónika Mendoza,40oocsATsGE,""No nos vengan con wevadas, nacionalización es igual que expropiación, el gas natural está al alcance de la población nacional, ahora que la gente confíe más en el galón de gas es distinto"",2021-09-28T21:39:41Z"												
"Verónika Mendoza,40oocsATsGE,""""""Nacionalizar no es expropiar"""""												
"Eso dile a Bolivia y a Venezuela"",2021-09-28T21:35:35Z"												
Verónika Mendoza,40oocsATsGE,Seccion de  trolls fujimoristas ¡¡¡ vivan las organizaciones criminales ¡¡¡,2021-09-28T21:29:55Z												
Verónika Mendoza,40oocsATsGE,Que alguien le explique a esta brutaa,2021-09-28T21:28:28Z												
Verónika Mendoza,40oocsATsGE,Veronica van arruinar al peru,2021-09-28T21:24:40Z												
"Verónika Mendoza,40oocsATsGE,""Que van a decir expropiacion, si ese termino ya esta manoseado, para pasar caleta dice que va a nacionalizar "	" es la misma cosa"",2021-09-28T21:24:18Z"											
Verónika Mendoza,40oocsATsGE,?????????? alguien le sigue creyendo a esta ? ??????,2021-09-28T21:24:07Z												
Verónika Mendoza,40oocsATsGE,Pobre Verónica no sabe como figurar,2021-09-28T21:19:22Z												
"Verónika Mendoza,40oocsATsGE,""Es una lunatica lo que quieren es subir impuestos igual mas informalidad y nacionalizar el gas, ESTAN ACTUANDO A LO BESTIA, A LO ANIMAL, acaso ¿Quieren destruir la ecónomia del pais?."												
"Urgente vacancia..........no tienen norte quieren hacer locuras."",2021-09-28T21:18:28Z"												
Verónika Mendoza,40oocsATsGE,Cuando suba el Dólar ya saben a quien agradecer,2021-09-28T21:12:09Z												
"Verónika Mendoza,40oocsATsGE,""NO HAY NADA DE POPULISMO ES PRIORITARIO, PORQUE EXISTE UN SAQUEO DE NUESTROS RECURSOS Y NOSOTROS TENEMOS QUE PAGAR EL GLP MAS CARO DEL SUDAMERICA. ESTAS EMPRESAS EVADEN IMPUESTOS, CONTRATAN PERSONAL TECNICO DE OTROS PAISES, EXPLOTAN A LOS OBREROS A TRAVES DE LOS SERVICES, CONTAMINAN, ETC. SU APORTACION AL ESTADO ES INFIMA. PRENSA NO DEN OPINIONES TERGIVERSADAS, DIRECCIONADAS, CREAN CONFUCION, ETC. NO JODAN DEJENLO SOLUCIONAR LOS PROBLEMAS DEL PAIS."",2021-09-28T21:11:39Z"												
"Verónika Mendoza,40oocsATsGE,""""""No es Plagio, es Copia"""". Estos Socialistas, cuando entenderán que sus medidas NO FUNCIONAN."",2021-09-28T21:02:19Z"												
"Verónika Mendoza,40oocsATsGE,""Esta es la peor de los socialistas. Primero salió a joder porque las farmacias multiplicaron sus precios, oferta y demanda, esta no entiende eso, las farmacias tenían derecho a subir los precios, luego reclamaban por el oxígeno, ahora también quieren gas barato. Menos mal que tenemos una derecha fuerte y unida para defender al privado y el precio actual. En el siguiente período lo primero que debe hacer la derecha es poner fin a todo rastro de socialismo, eliminar beca18, sis, pension65. Dar leyes más fuertes para proteger a camisea, mineras contra estos socialistas que quieren mas dinero para desperdiciarlo manteniendo socialistas vagos que reciben salud, educación con nuestros impuestos"",2021-09-28T21:01:17Z"												
"Verónika Mendoza,40oocsATsGE,""No, el gas no es muy usada regularmente por los pocos ingresos y oportunidades en provincias, la privatizacion es importante para el empleo y desarrollo en el país? No a la Nacionalización? Arriba el Perú."",2021-09-28T21:00:42Z"												
Verónika Mendoza,40oocsATsGE,Qué populismo... Cómo cuzqueña tiene todo el derecho a reclamar por las cagadas de PPKUTRA y Toledo,2021-09-28T21:00:23Z												
"Verónika Mendoza,40oocsATsGE,""Estos periodistas como mal informan nacionalizar negociando los contratos a favor de ambas partes q Nadie abuse de nadie, y expropiar no se negocia se le quita su negocio ( se adueñan) y punto. Cómo hacen las munipalidades con un ambulante le quitan todo su mercadería su carrito eso es expropiar. Si al cambio."",2021-09-28T20:58:20Z"												
"Verónika Mendoza,40oocsATsGE,""El 10% de hogares que tienen ese acceso es porque tienen conexiones intradomiciliarias, subsidiadas por el gobierno, puesto que nuestro gas es mayormente metano, producimos poco GLP (propano butano), e incluso lo importamos, el metano no puede envasarse en balones, necesita ductos (gasoductos). El gasoducto sur que es para beneficio de Cuzco, Puno, Tacna, es el que se debe seguir construyendo, y allí entra el famoso caso Odebrecht"",2021-09-28T20:57:28Z"												
Verónika Mendoza,40oocsATsGE,Manotazo de ahogado de una señora que quiere su cuota de poder en el actual gobierno..seras candidata más tiempo que keiko xD,2021-09-28T20:57:05Z												
Verónika Mendoza,40oocsATsGE,ESE TRIO DE TERRUCAS...SI COMO NOOO VERO PARA CUANDO LAS AJENDAS...LA SECRE DE NANIN....,2021-09-28T20:53:59Z												
